{
  "registry_version": "ylsb-candidate-model-0.1",
  "registry_kind": "candidate_catalog",
  "observed_registry": "registries/models.json",
  "retrieved_at": "2026-09-07",
  "entries": [
    {
      "canonical_id": "candidate.qwen3.5.0.8b.q4",
      "reported_name": "Qwen3.5-0.8B (Q4 estimate)",
      "family": "qwen3.5",
      "architecture": {"type": "dense", "total_params_b": 0.8, "active_params_b": 0.8, "expert_count": null, "active_experts": null},
      "quant": "Q4_K_M",
      "bpw": 4.5,
      "quantization_status": "estimated",
      "format": "GGUF",
      "context_length": 262144,
      "parameter_scope": "language_model_only; vision_encoder_parameter_count_unknown",
      "status": "stable",
      "source": "https://huggingface.co/Qwen/Qwen3.5-0.8B",
      "retrieved_at": "2026-09-07",
      "provenance": {"kind": "registry", "source_type": "official_model_card", "source": "https://huggingface.co/Qwen/Qwen3.5-0.8B", "retrieved_at": "2026-09-07", "reported_fields": ["family", "architecture.type", "architecture.total_params_b", "architecture.active_params_b", "context_length"], "estimated_fields": ["quant", "bpw", "format"], "note": "Official card reports a 0.8B language model and 262,144 native context; the separate vision encoder parameter count is unknown; Q4_K_M is a planner estimate until an artifact is selected."},
      "registry_kind": "candidate",
      "observed": false
    },
    {
      "canonical_id": "candidate.qwen3.5.4b.q4",
      "reported_name": "Qwen3.5-4B (Q4 estimate)",
      "family": "qwen3.5",
      "architecture": {"type": "dense", "total_params_b": 4.0, "active_params_b": 4.0, "expert_count": null, "active_experts": null},
      "quant": "Q4_K_M",
      "bpw": 4.5,
      "quantization_status": "estimated",
      "format": "GGUF",
      "context_length": 262144,
      "parameter_scope": "language_model_only; vision_encoder_parameter_count_unknown",
      "status": "stable",
      "source": "https://huggingface.co/Qwen/Qwen3.5-4B",
      "retrieved_at": "2026-09-07",
      "provenance": {"kind": "registry", "source_type": "official_model_card", "source": "https://huggingface.co/Qwen/Qwen3.5-4B", "retrieved_at": "2026-09-07", "reported_fields": ["family", "architecture.type", "architecture.total_params_b", "architecture.active_params_b", "context_length"], "estimated_fields": ["quant", "bpw", "format"], "note": "Official card reports a 4B language model and 262,144 native context; the separate vision encoder parameter count is unknown; Q4_K_M is a planner estimate until an artifact is selected."},
      "registry_kind": "candidate",
      "observed": false
    },
    {
      "canonical_id": "candidate.qwen3.5.9b.q4",
      "reported_name": "Qwen3.5-9B (Q4 estimate)",
      "family": "qwen3.5",
      "architecture": {"type": "dense", "total_params_b": 9.0, "active_params_b": 9.0, "expert_count": null, "active_experts": null},
      "quant": "Q4_K_M",
      "bpw": 4.5,
      "quantization_status": "estimated",
      "format": "GGUF",
      "context_length": 262144,
      "parameter_scope": "language_model_only; vision_encoder_parameter_count_unknown",
      "status": "stable",
      "source": "https://huggingface.co/Qwen/Qwen3.5-9B",
      "retrieved_at": "2026-09-07",
      "provenance": {"kind": "registry", "source_type": "official_model_card", "source": "https://huggingface.co/Qwen/Qwen3.5-9B", "retrieved_at": "2026-09-07", "reported_fields": ["family", "architecture.type", "architecture.total_params_b", "architecture.active_params_b", "context_length"], "estimated_fields": ["quant", "bpw", "format"], "note": "Official card reports a 9B language model and 262,144 native context; the separate vision encoder parameter count is unknown; Q4_K_M is a planner estimate until an artifact is selected."},
      "registry_kind": "candidate",
      "observed": false
    },
    {
      "canonical_id": "candidate.qwen2.5.0.5b-instruct.q4",
      "reported_name": "Qwen2.5-0.5B-Instruct (Q4 estimate)",
      "family": "qwen2.5",
      "architecture": {"type": "dense", "total_params_b": 0.49, "active_params_b": 0.49, "expert_count": null, "active_experts": null},
      "quant": "Q4_K_M",
      "bpw": 4.5,
      "quantization_status": "estimated",
      "format": "GGUF",
      "context_length": 32768,
      "status": "stable",
      "source": "https://huggingface.co/Qwen/Qwen2.5-0.5B-Instruct",
      "retrieved_at": "2026-09-07",
      "provenance": {"kind": "registry", "source_type": "official_model_card", "source": "https://huggingface.co/Qwen/Qwen2.5-0.5B-Instruct", "retrieved_at": "2026-09-07", "reported_fields": ["family", "architecture.total_params_b", "context_length"], "estimated_fields": ["quant", "bpw", "format"], "note": "Official card reports BF16 model facts; Q4_K_M is a planner estimate until an artifact is selected."},
      "registry_kind": "candidate",
      "observed": false
    },
    {
      "canonical_id": "candidate.qwen2.5.14b-instruct.q4",
      "reported_name": "Qwen2.5-14B-Instruct (Q4 estimate)",
      "family": "qwen2.5",
      "architecture": {"type": "dense", "total_params_b": 14.7, "active_params_b": 14.7, "expert_count": null, "active_experts": null},
      "quant": "Q4_K_M",
      "bpw": 4.5,
      "quantization_status": "estimated",
      "format": "GGUF",
      "context_length": 131072,
      "status": "stable",
      "source": "https://huggingface.co/Qwen/Qwen2.5-14B-Instruct",
      "retrieved_at": "2026-09-07",
      "provenance": {"kind": "registry", "source_type": "official_model_card", "source": "https://huggingface.co/Qwen/Qwen2.5-14B-Instruct", "retrieved_at": "2026-09-07", "reported_fields": ["family", "architecture.total_params_b", "context_length"], "estimated_fields": ["quant", "bpw", "format"], "note": "Official card reports BF16 model facts; Q4_K_M is a planner estimate until an artifact is selected."},
      "registry_kind": "candidate",
      "observed": false
    },
    {
      "canonical_id": "candidate.qwen3.30b-a3b.moe.q4",
      "reported_name": "Qwen3-30B-A3B MoE (Q4 estimate)",
      "family": "qwen3",
      "architecture": {"type": "moe", "total_params_b": 30.5, "active_params_b": 3.3, "expert_count": 128, "active_experts": 8},
      "quant": "Q4_K_M",
      "bpw": 4.5,
      "quantization_status": "estimated",
      "format": "GGUF",
      "context_length": 32768,
      "status": "stable",
      "source": "https://huggingface.co/Qwen/Qwen3-30B-A3B",
      "retrieved_at": "2026-09-07",
      "provenance": {"kind": "registry", "source_type": "official_model_card", "source": "https://huggingface.co/Qwen/Qwen3-30B-A3B", "retrieved_at": "2026-09-07", "reported_fields": ["family", "architecture.type", "architecture.total_params_b", "architecture.active_params_b", "architecture.expert_count", "architecture.active_experts", "context_length"], "estimated_fields": ["quant", "bpw", "format"], "note": "Official Qwen card reports 30.5B total, 3.3B active, 128 experts and 8 active experts; Q4_K_M is a planner estimate until an artifact is selected."},
      "registry_kind": "candidate",
      "observed": false
    },
    {
      "canonical_id": "candidate.qwen2.5.32b-instruct.q4",
      "reported_name": "Qwen2.5-32B-Instruct (Q4 estimate)",
      "family": "qwen2.5",
      "architecture": {"type": "dense", "total_params_b": 32.5, "active_params_b": 32.5, "expert_count": null, "active_experts": null},
      "quant": "Q4_K_M",
      "bpw": 4.5,
      "quantization_status": "estimated",
      "format": "GGUF",
      "context_length": 131072,
      "status": "stable",
      "source": "https://huggingface.co/Qwen/Qwen2.5-32B-Instruct",
      "retrieved_at": "2026-09-07",
      "provenance": {"kind": "registry", "source_type": "official_model_card", "source": "https://huggingface.co/Qwen/Qwen2.5-32B-Instruct", "retrieved_at": "2026-09-07", "reported_fields": ["family", "architecture.total_params_b", "context_length"], "estimated_fields": ["quant", "bpw", "format"], "note": "Official card reports BF16 model facts; Q4_K_M is a planner estimate until an artifact is selected."},
      "registry_kind": "candidate",
      "observed": false
    },
    {
      "canonical_id": "candidate.llama3.1.70b-instruct.q4",
      "reported_name": "Llama 3.1 70B Instruct (Q4 estimate)",
      "family": "llama3.1",
      "architecture": {"type": "dense", "total_params_b": 70.0, "active_params_b": 70.0, "expert_count": null, "active_experts": null},
      "quant": "Q4_K_M",
      "bpw": 4.5,
      "quantization_status": "estimated",
      "format": "GGUF",
      "context_length": 131072,
      "status": "stable",
      "source": "https://huggingface.co/meta-llama/Llama-3.1-70B-Instruct",
      "retrieved_at": "2026-09-07",
      "provenance": {"kind": "registry", "source_type": "official_model_card", "source": "https://huggingface.co/meta-llama/Llama-3.1-70B-Instruct", "retrieved_at": "2026-09-07", "reported_fields": ["family", "architecture.total_params_b", "context_length"], "estimated_fields": ["quant", "bpw", "format"], "note": "Official card reports BF16 weights; Q4_K_M is a planner estimate until an artifact is selected."},
      "registry_kind": "candidate",
      "observed": false
    },
    {
      "canonical_id": "candidate.qwen2.5.72b-instruct.q4",
      "reported_name": "Qwen2.5-72B-Instruct (Q4 estimate)",
      "family": "qwen2.5",
      "architecture": {"type": "dense", "total_params_b": 72.7, "active_params_b": 72.7, "expert_count": null, "active_experts": null},
      "quant": "Q4_K_M",
      "bpw": 4.5,
      "quantization_status": "estimated",
      "format": "GGUF",
      "context_length": 131072,
      "status": "stable",
      "source": "https://huggingface.co/Qwen/Qwen2.5-72B-Instruct",
      "retrieved_at": "2026-09-07",